{
  "artifacts": {
    "axvisor_config": {
      "path": "/mnt/c/Users/10469/Workspace/starryos_t/tgoskits-rt-ivc/docs/realtime/axvisor-qemu-aarch64-partition.toml",
      "sha256": "27d2bf3a0e401da2836004221b61f70c1000eb94ea41c8df112356421591b703"
    },
    "guest_runner": {
      "path": "/mnt/c/Users/10469/Workspace/starryos_t/tgoskits-rt-ivc/tmp/competition/axvisor-rt/reference-20260731-partitioned-stress/axvisor-rt-run",
      "sha256": "260417ed08b6e7c4dbb73eed6b2fc764b7658f0c3dd7952b1e5b0a81007d6de7"
    },
    "injected_rootfs_pre_run": {
      "path": "/mnt/c/Users/10469/Workspace/starryos_t/tgoskits-rt-ivc/tmp/competition/axvisor-rt/reference-20260731-partitioned-stress/rootfs.img",
      "sha256": "898ee8b4145ae2aa3729de820cf21a7e3a2417527014c93bae598feea19e81a2"
    },
    "input_rootfs": {
      "path": "/mnt/c/Users/10469/Workspace/starryos_t/tgoskits-rt-ivc/tmp/axbuild/rootfs/rootfs-aarch64-alpine.img/rootfs-aarch64-alpine.img",
      "sha256": "5009e544c1f1e941034475c2757ac47997d323855429a95686049c815a849975"
    },
    "probe": {
      "path": "/mnt/c/Users/10469/Workspace/starryos_t/tgoskits-rt-ivc/tmp/competition/axvisor-rt/reference-20260731-partitioned-stress/axvisor-rt-probe",
      "sha256": "8b3f6e7471dc9ecf60d5b64ab5f3c3a4657af8743fde1aa6b1772358c62806da"
    },
    "qemu_config": {
      "path": "/mnt/c/Users/10469/Workspace/starryos_t/tgoskits-rt-ivc/scripts/benchmark/axvisor-rt/qemu-aarch64.toml",
      "sha256": "3d168c8e466dfec69cd8593e05c098f4da50a1cc51853065ce085dbfaf3286d6"
    },
    "raw_log": {
      "path": "/mnt/c/Users/10469/Workspace/starryos_t/tgoskits-rt-ivc/tmp/competition/axvisor-rt/reference-20260731-partitioned-stress/raw-console.log",
      "sha256": "9361542d542a141462c1504d12cc450438e2f05fce0c5bd044731de7aff4d76c"
    },
    "vm_config": {
      "path": "/mnt/c/Users/10469/Workspace/starryos_t/tgoskits-rt-ivc/os/axvisor/configs/vms/qemu/aarch64/linux-smp2-dedicated.toml",
      "sha256": "b317d5728d254d061f896040af0d1c2fe97e4a1b389249ab702c0ad3acd3a5c0"
    }
  },
  "benchmark": {
    "fifo_priority": 80,
    "guest_cpu": 0,
    "iterations": 10000,
    "metrics": [
      "periodic_jitter",
      "dispatch_latency",
      "emulated_irq_response"
    ],
    "period_ns": 1000000,
    "warmup_iterations": 100,
    "workload": "cpu-stress"
  },
  "finished_at": "2026-07-31T00:20:18Z",
  "guest": {
    "architecture": "aarch64",
    "dedicated_host_cpu_ids": [
      2,
      3
    ],
    "profile": "partitioned",
    "vcpu_count": 2,
    "vm_config": "os/axvisor/configs/vms/qemu/aarch64/linux-smp2-dedicated.toml"
  },
  "host": {
    "machine": "x86_64",
    "release": "6.18.33.2-microsoft-standard-WSL2",
    "system": "Linux"
  },
  "qemu": {
    "acceleration": "tcg",
    "binary": "qemu-system-aarch64",
    "cpu": "cortex-a72",
    "exit_code": 0,
    "host_cpu_count": 4,
    "machine": "virt,virtualization=on,gic-version=3",
    "version": "QEMU emulator version 10.0.3"
  },
  "repository": {
    "commit": "263f89d8f3d0481d2712224a7b517a73b1165fb3",
    "dirty": true,
    "source_snapshot_sha256": "8594ab76e903dd179db5f1aa91546c03a7d759454d300b2ac6c665933ab0216a",
    "tracked_diff_sha256": "13e7a0689bd1e2606c76b8373b2701cf1bbc6f2bed4201e60269e1915d9cc7f5",
    "untracked_source_file_count": 89,
    "untracked_source_manifest_sha256": "4f8072e04fb5619c5157bb7b58682474a55c5c1b5b2a48567fd09330f78c0eaf"
  },
  "run_id": "20260731T000957Z",
  "schema_version": 1,
  "started_at": "2026-07-31T00:10:20Z",
  "status": "capture_complete"
}
